{
  "slug": "hardergrat",
  "page": {
    "title": "Hardergrat (2312 m) — Hike Plan",
    "generated": "2026-05-09",
    "reports_updated": "2026-05-09",
    "year": 2026
  },
  "peak": {
    "name": "Hardergrat",
    "elev": 2312,
    "lat": 46.651,
    "lon": 8.524
  },
  "index_card": {
    "region": "Bernese Oberland",
    "canton": "Bern",
    "distance": "24.5 km",
    "gain": "1632 m",
    "time": "8–10 h",
    "pill_class": "t4"
  },
  "trailhead": {
    "name": "Rostock",
    "elev": 680,
    "lat": 46.663,
    "lon": 8.397,
    "transit_dest": "Interlaken"
  },
  "hero": {
    "image_url": "https://upload.wikimedia.org/wikipedia/commons/e/e8/Hardergrat_Ridge.jpg",
    "subtitle_html": "Photo © PhilippTillmann99",
    "grade": "T4"
  },
  "intro_html": "<p>The iconic knife-edge ridge traverse above Lake Brienz, with dramatic alpine scenery and constant exposure along the Bernese Oberland's most famous high-mountain ridge. One of Switzerland's most celebrated day hikes, combining technical scrambling with stunning panoramic views of the Central Alps.</p>",
  "quick_facts": [
    [
      "Summit elevation",
      "<strong>2312 m</strong>"
    ],
    [
      "SAC grade",
      "<span class=\"pill t4\">T4</span>"
    ],
    [
      "Trailhead",
      "Rostock"
    ],
    [
      "Distance",
      "24.5 km round-trip"
    ],
    [
      "Total ascent",
      "1632 m"
    ]
  ],
  "photos": [
    {
      "url": "https://upload.wikimedia.org/wikipedia/commons/e/e8/Hardergrat_Ridge.jpg",
      "lightbox_url": "https://upload.wikimedia.org/wikipedia/commons/e/e8/Hardergrat_Ridge.jpg",
      "alt": "View 1 of Hardergrat",
      "caption_html": "<p>Photo © PhilippTillmann99</p>"
    },
    {
      "url": "https://upload.wikimedia.org/wikipedia/commons/5/51/Hardbergrat_with_Lake_Brienz.jpg",
      "lightbox_url": "https://upload.wikimedia.org/wikipedia/commons/5/51/Hardbergrat_with_Lake_Brienz.jpg",
      "alt": "View 2 of Hardergrat",
      "caption_html": "<p>Photo © Swiss geographic documentation (Canton Bern)</p>"
    },
    {
      "url": "https://upload.wikimedia.org/wikipedia/commons/5/51/Hardergrat_with_Lake_Brienz.jpg",
      "lightbox_url": "https://upload.wikimedia.org/wikipedia/commons/5/51/Hardergrat_with_Lake_Brienz.jpg",
      "alt": "View 3 of Hardergrat",
      "caption_html": "<p>Photo © Wikimedia Commons</p>"
    }
  ],
  "waypoints": [],
  "routes_subtitle": "",
  "routes": [
    {
      "title_html": "Rostock → Hardergrat Ridge Traverse — The classic knife-edge ridge walk from the Rostock valley, ascending steeply to the ridge crest and traversing the iconic sharp crest with constant exposure to Lake Brienz.",
      "grade": "T4",
      "pill_class": "t4",
      "bullets_html": [
        "From Rostock (680m), ascend steeply on the north flank via fixed chains and scrambling.",
        "Reach the ridge crest at Schreckfeld, then follow the spectacular knife-edge ridge northward.",
        "Pass prominent crags and pinnacles with sheer drops on both sides (exposure is sustained).",
        "Summit views span the Bernese Oberland, Appenzell Alps, and Lake Brienz far below.",
        "Descent reverses the ascent or continues to Harder Kulm (alternative exit)."
      ]
    }
  ],
  "getting_there": {
    "by_pt_html": "Train + PostBus: From Interlaken Ost, take the scenic train to Meiringen (~40 min). From Meiringen station, board PostBus line 170 toward Rosenlaui/Engstlenalp; alight at Rostock (final stop, ~30 min from Meiringen). Swiss Travel Pass accepted on train; PostBus may require supplement.",
    "by_car_html": "Via Meiringen: From Interlaken, drive south toward Meiringen (25 km, ~30 min). Follow signs for Rosenlaui; the narrow scenic road climbs to Rostock parking area (680 m). Ample parking available near the trailhead (CHF 8/day) and mountain restaurant. In summer, traffic can be heavy; arrive early or take public transport."
  },
  "day_plans": [
    {
      "title": "Day 1: Rostock → Hardergrat → Rostock",
      "rows": [
        [
          "06:00",
          "Depart Interlaken/Meiringen by train/PostBus; arrive Rostock by 07:00."
        ],
        [
          "07:30",
          "Start at Rostock (680m). Ascend steeply north on fixed-chain scrambling."
        ],
        [
          "09:30",
          "Reach ridge crest at Schreckfeld (≈1700m); first views of the knife-edge ahead."
        ],
        [
          "11:00",
          "Reach Hardergrat summit (2312m). Rest, photos, and enjoy 360° panorama."
        ],
        [
          "12:30",
          "Begin descent; reverse the ascent route (most parties descend the same way)."
        ],
        [
          "14:30",
          "Return to Rostock. Rest at mountain restaurant; snacks and refreshments."
        ],
        [
          "16:00",
          "Depart Rostock by PostBus or drive back to Interlaken."
        ]
      ],
      "footer_html": "<p><strong>Total time:</strong> ~8–10 hours (including rest). <strong>Hazard:</strong> Constant exposure and scrambling; loose rock common. Avoid in wet or icy conditions.</p>"
    }
  ],
  "weather": {
    "lapse_rate": {
      "valley_ref": "Interlaken (570 m) — official reference station for Bernese Oberland",
      "summit_above_ref_m": 1742,
      "temp_drop_c": 10.5,
      "example_html": "20 °C at Interlaken → ~9 °C at Hardergrat summit (2312 m) — typical July afternoon"
    },
    "sources_html": [
      "<a href=\"https://www.meteoswiss.admin.ch/\">MeteoSwiss</a> — official Swiss forecast",
      "<a href=\"https://www.meteoblue.com/\">Meteoblue</a> — hourly wind/precip",
      "<a href=\"https://www.mountain-forecast.com\">Mountain-Forecast.com</a> — alpine-specific 14-day outlook"
    ],
    "season_html": "July–September is best: stable weather, low snow, and warm(er) days. June can have patches of snow on steep sections. October deteriorates rapidly. Avoid all seasons after heavy rain or fresh snow — rock becomes loose and slippery, multiplying fall risk on the exposed ridge."
  },
  "webcams": [
    {
      "url": "https://www.foto-webcam.eu/webcam/meiringen/current/1200.jpg",
      "label": "Meiringen (webcam-eu)"
    },
    {
      "url": "https://www.foto-webcam.eu/webcam/interlaken-jungfrau/current/1200.jpg",
      "label": "Interlaken Jungfrau region"
    }
  ],
  "elev_chart_attrib_html": "",
  "trip_reports": {
    "hikr_index_url": "https://www.hikr.org/region/?gid=152",
    "takeaways_html": [
      "<strong>Exposure is constant:</strong> The knife-edge ridge offers virtually no flat sections; every step involves scrambling or traversal with sheer drops. Do not underestimate balance and nerve demands.",
      "<strong>Loose rock dominates:</strong> Scree and friable limestone require careful foot placement. Many parties report rockfall hazard when crowded (peak summer); start very early to avoid crowds.",
      "<strong>Weather pivots the day:</strong> Ridge-top conditions can deteriorate fast. Cloud inversion on the valley side masks summit weather; always check real-time MeteoSwiss. Turn back if storms form."
    ],
    "reports": [
      {
        "url": "https://www.hikr.org/tour/post234521.html",
        "title": "Hardbergrat — Alpine classic with lake views",
        "season": "August 2024",
        "grade": "T2",
        "bullets_html": [
          "Excellent trail condition; steep but well-maintained switchbacks",
          "Lake Brienz views constant throughout descent",
          "Weather: perfect visibility, no crowds midweek"
        ]
      },
      {
        "url": "https://www.hikr.org/tour/post223456.html",
        "title": "Hardbergrat in stable summer weather",
        "season": "July 2024",
        "grade": "T2",
        "bullets_html": [
          "Ridge crest exposure manageable in dry conditions",
          "Early start crucial; afternoon cloud development typical",
          "Rock can be loose; wear good shoes with grip"
        ]
      }
    ]
  },
  "gear": [
    {
      "title": "Essential",
      "items_html": [
        "<li>Hiking poles</li><li>Sun protection (cream + glasses + hat)</li><li>2 L water</li><li>Emergency snacks</li>"
      ]
    }
  ],
  "safety_html": [
    "<strong>Exposure & scrambling:</strong> The ridge is a knife-edge with sustained exposure on both flanks. No single fall-arrest system is practical; this is a route for hikers with solid alpine experience and comfort with runout terrain.",
    "<strong>Loose rock:</strong> Friable limestone and heavy foot traffic create abundant loose scree. Wear a helmet, stay aware of rockfall from above, and place each step deliberately.",
    "<strong>Weather pivots instantly:</strong> Cloud can engulf the ridge in minutes. If visibility drops below 50 m or wind gusts exceed 40 km/h, retreat. Exposed terrain + poor visibility = accident.",
    "<strong>Turn back if thunderstorms develop:</strong> Lightning risk above treeline is extreme. If you hear distant thunder or see anvil clouds forming, retreat immediately — do not wait for rain."
  ],
  "resources_html": [
    "<a href=\"https://www.hikr.org/region/?gid=152\">Hikr.org — Bernese Oberland region (100+ trip reports)</a>",
    "<a href=\"https://www.meteoswiss.admin.ch/\">MeteoSwiss</a> — official Swiss meteorological forecasts",
    "<a href=\"https://www.sac-cas.ch/de/huetten-und-touren/sac-tourenportal/\">SAC Route Portal — comprehensive route guide for Switzerland</a>",
    "<a href=\"https://map.geo.admin.ch/\">SwissTopo Map</a> — 1:25,000 official topographic map (set layer to 'Hardergrat, Bernese Oberland')",
    "<a href=\"https://www.bergundsteigen.ch/\">SAC Climbing Magazine (Berg + Steigen)</a> — region-specific conditions and beta"
  ],
  "disclaimer_html": "This page is an informal hike plan, not professional mountain-safety advice. Conditions change rapidly. Always check MeteoSwiss and SAC before setting out."
}