{
  "slug": "spannort",
  "page": {
    "title": "Spannort (2535 m) — Hike Plan",
    "generated": "2026-05-10",
    "reports_updated": "2026-05-10",
    "year": 2026
  },
  "peak": {
    "name": "Spannort",
    "elev": 2535,
    "lat": 46.6557,
    "lon": 8.6485
  },
  "index_card": {
    "region": "Central Switzerland",
    "canton": "Uri",
    "distance": "TODO: e.g. 8.4 km",
    "gain": "TODO: e.g. 850 m",
    "time": "TODO: e.g. 5–6 h",
    "pill_class": "t2"
  },
  "trailhead": {
    "name": "Andermatt",
    "elev": 0,
    "lat": 46.6612,
    "lon": 8.6412,
    "transit_dest": "Andermatt, Switzerland"
  },
  "hero": {
    "image_url": "TODO: Wikimedia Special:FilePath URL at width=1600",
    "subtitle_html": "TODO: e.g. Andermatt → Spannort — <span class=\"pill t2\">SAC T2</span> · ~850 m gain · ~8.4 km · ~5h round-trip",
    "grade": "T2"
  },
  "intro_html": "TODO: <p>2–3 sentences about the route character and highlights.</p>",
  "quick_facts": [
    [
      "Summit elevation",
      "<strong>2535 m</strong>"
    ],
    [
      "SAC grade",
      "<span class=\"pill t2\">T2</span>"
    ],
    [
      "Trailhead",
      "Andermatt"
    ],
    [
      "Distance",
      "TODO: km round-trip"
    ],
    [
      "Total ascent",
      "TODO: m"
    ]
  ],
  "photos": [
    {
      "url": "TODO: Wikimedia width=600 URL",
      "lightbox_url": "TODO: Wikimedia width=1600 URL",
      "alt": "TODO: description",
      "caption_html": "TODO: caption"
    }
  ],
  "waypoints": [],
  "routes_subtitle": "",
  "routes": [
    {
      "title_html": "TODO: route name",
      "grade": "T2",
      "pill_class": "t2",
      "bullets_html": [
        "TODO: <li>Step 1: description.</li>",
        "TODO: <li>Step 2: description.</li>"
      ],
      "source": "TODO: e.g. OSM hiking network or SAC Route Portal"
    }
  ],
  "getting_there": {
    "by_pt_html": "TODO: SBB / PostBus connection description.",
    "by_car_html": "TODO: Driving directions."
  },
  "day_plans": [
    {
      "title": "Day 1",
      "rows": [
        [
          "HH:MM",
          "TODO: step description"
        ]
      ],
      "footer_html": ""
    }
  ],
  "weather": {
    "lapse_rate": {
      "valley_ref": "TODO: nearest valley station and elevation, e.g. Interlaken (570 m)",
      "summit_above_ref_m": 1935,
      "temp_drop_c": 11.6,
      "example_html": "TODO: e.g. <strong>22 °C at Interlaken → ~9 °C at summit</strong>"
    },
    "sources_html": [
      "<a href=\"https://www.meteoswiss.admin.ch/\">MeteoSwiss</a> — official Swiss forecast",
      "<a href=\"https://www.meteoblue.com/\">Meteoblue</a> — hourly wind/precip"
    ],
    "season_html": "TODO: e.g. <strong>July–September</strong> is best; avoid after fresh snow."
  },
  "webcams": [
    {
      "url": "TODO: https://www.foto-webcam.eu/webcam/<nearest-cam>/current/1200.jpg",
      "label": "TODO: camera name",
      "fallback": false
    }
  ],
  "elev_chart_attrib_html": "",
  "trip_reports": {
    "hikr_index_url": "TODO: https://www.hikr.org/region/?gid=...",
    "takeaways_html": [
      "TODO: cross-report pattern 1.",
      "TODO: cross-report pattern 2."
    ],
    "reports": [
      {
        "url": "TODO: hikr report URL",
        "title": "TODO: report title",
        "season": "TODO: e.g. August 2025",
        "grade": "T2",
        "bullets_html": [
          "TODO: <li>Key observation 1.</li>",
          "TODO: <li>Key observation 2.</li>"
        ]
      }
    ]
  },
  "gear": [
    {
      "title": "Essential",
      "items_html": [
        "<li>Hiking poles</li>",
        "<li>Sun protection (cream + glasses + hat)</li>",
        "<li>2 L water</li>",
        "<li>Emergency snacks</li>"
      ]
    }
  ],
  "safety_html": [
    "TODO: main hazard — e.g. <strong>Exposure</strong>: ... ",
    "Turn back if thunderstorms develop — lightning risk above treeline is extreme."
  ],
  "resources_html": [
    "<a href=\"TODO: SAC route URL\">SAC Route Portal — Spannort</a>",
    "<a href=\"https://www.meteoswiss.admin.ch/\">MeteoSwiss</a>",
    "<a href=\"TODO: SwissTopo map URL\">SwissTopo map</a>"
  ],
  "disclaimer_html": "This page is an informal hike plan, not professional mountain-safety advice. Conditions change rapidly. Always check MeteoSwiss and SAC before setting out."
}
