{
  "slug": "gornergrat-riffelalp",
  "page": {
    "title": "Gornergrat & Riffelalp (3135 m) — Hike Plan",
    "generated": "2026-05-09",
    "reports_updated": "2026-05-09",
    "year": 2026
  },
  "peak": {
    "name": "Gornergrat",
    "elev": 3135,
    "lat": 46.4196,
    "lon": 7.9807
  },
  "index_card": {
    "region": "Valais",
    "canton": "Valais",
    "distance": "6–7 km",
    "gain": "600 m",
    "time": "3–4 h",
    "pill_class": "t2"
  },
  "trailhead": {
    "name": "Zermatt",
    "elev": 1620,
    "lat": 46.0185,
    "lon": 7.749,
    "transit_dest": "Zermatt"
  },
  "hero": {
    "image_url": "https://upload.wikimedia.org/wikipedia/commons/a/a3/Gornergrat_mit_Matterhorn_4478.jpg",
    "subtitle_html": "Photo © Daniel Reust (CC BY-SA 4.0) — Matterhorn from Gornergrat",
    "grade": "T2"
  },
  "intro_html": "<p>Switzerland's most photographed easy alpine hike: traverse past five glacier-fed lakes—Riffelsee, Stellisee, Grindjesee, and more—with the Matterhorn reflected in crystalline waters at every turn. Accessible via the Gornergrat Railway from car-free Zermatt, this quintessential Valais experience combines accessibility with breathtaking alpine scenery.</p>",
  "quick_facts": [
    [
      "Summit elevation",
      "<strong>3135 m</strong>"
    ],
    [
      "SAC grade",
      "<span class=\"pill t2\">T2</span>"
    ],
    [
      "Trailhead",
      "Zermatt"
    ],
    [
      "Distance",
      "TODO: km round-trip"
    ],
    [
      "Total ascent",
      "TODO: m"
    ]
  ],
  "photos": [
    {
      "url": "https://f.hikr.org/files/3831865.jpg",
      "lightbox_url": "https://f.hikr.org/files/3831865.jpg",
      "alt": "Matterhorn and glaciers from Gornergrat",
      "caption_html": "<p>Photo via hikr.org</p>"
    },
    {
      "url": "https://f.hikr.org/files/2806308.jpg",
      "lightbox_url": "https://f.hikr.org/files/2806308.jpg",
      "alt": "Gornergrat panorama",
      "caption_html": "<p>Photo via hikr.org</p>"
    },
    {
      "url": "https://f.hikr.org/files/2806307.jpg",
      "lightbox_url": "https://f.hikr.org/files/2806307.jpg",
      "alt": "Riffelalp hut view",
      "caption_html": "<p>Photo via hikr.org</p>"
    }
  ],
  "waypoints": [],
  "routes_subtitle": "",
  "routes": [
    {
      "title_html": "Gornergrat Ridge & Riffelalp Loop — Grade: T2 (Hiking) | Elevation gain: 400 m | Time: 3–4 hours | Distance: ~7 km. Scenic alpine walk from Gornergrat (3,110 m) descending to Riffelalp via the exposed east ridge, returning via Rotenboden to Riffelalp station. Outstanding Matterhorn viewpoint throughout the route. Well-marked, safe trail suitable for mountain-experienced hikers.",
      "grade": "T2",
      "pill_class": "t2",
      "bullets_html": [
        "TODO: <li>Step by step.</li>"
      ]
    }
  ],
  "getting_there": {
    "by_pt_html": "By Train: Take the main rail line to Visp or Brig (via Zurich, Bern, or Geneva). Visp to Zermatt: Take the Matterhorn Gotthard Bahn (MGB) regional train from Visp to Zermatt (1.5 hours, runs hourly). Zermatt to Gornergrat: From Zermatt train station, walk 50 m to the Gornergrat Bahn (GGB) mountain railway station. The rack railway climbs 1,620 m vertically in just 9 km, reaching Gornergrat in approximately 40 minutes. Departures every 20–30 minutes in summer (typically 07:00–16:30, with later departures on clear evenings). Journey time from Geneva: Approximately 4–5 hours total (train + transfers). Swiss Travel Pass / Half-Fare Card: Valid on all mountain railways in the region.",
    "by_car_html": "From Basel / Zurich / Geneva: Drive via A2/A9 motorway towards Valais. Exit at Visp or Brig, then head south to Zermatt (63 km from Visp, approximately 1.5 hours). Parking in Zermatt: No personal cars allowed in Zermatt village. Leave your car at a parking facility: Parkhaus Zermatt: Large multi-story car park near the train station entrance (CHF 15–20/day). Parking Winkelmatten: Larger lot on the outskirts, slightly cheaper. Free parking: Some spaces available along Bahnhofstrasse early morning (limited, first-come basis). Free shuttle bus runs frequently between car parks and village centre. Walk to Gornergrat railway station (5–10 min) or use electric taxis (Zermatt is car-free)."
  },
  "day_plans": [
    {
      "title": "Day 1",
      "rows": [
        [
          "HH:MM",
          "TODO: step description"
        ]
      ],
      "footer_html": ""
    }
  ],
  "weather": {
    "lapse_rate": {
      "valley_ref": "Zermatt (1,620 m)",
      "summit_above_ref_m": 2535,
      "temp_drop_c": 15.2,
      "example_html": "Zermatt +20°C → Gornergrat approximately +5°C (roughly 1°C per 300 m elevation gain). Example: If 20°C in Zermatt, expect 5–8°C on Gornergrat with significant wind chill."
    },
    "sources_html": [
      "<a href=\"https://www.meteoswiss.admin.ch/\">MeteoSwiss</a> — official Swiss forecast",
      "<a href=\"https://www.meteoblue.com/\">Meteoblue</a> — hourly wind/precip"
    ],
    "season_html": "Best season: June–September. July–August offers the most stable weather and shortest daylight hours are still sufficient for full-day tours. June: Snow possible above 3,000 m, glacier crossings may be risky. July–August: Optimal conditions; high tourist traffic. September: Fewer crowds, reliable weather, still excellent conditions. October onwards: Significant snow, railway may close during storms. Weather hazards: Rapid afternoon thunderstorms (common June–August). Strong föhn winds from south. UV intensity extreme at altitude—bring high-SPF sunscreen. Temperature can drop rapidly; layer clothing. Wind-chill makes conditions feel 10–15°C colder than actual temperature."
  },
  "webcams": [
    {
      "url": "https://www.gornergrat.ch/en/webcam",
      "label": "Gornergrat Live Cam – Matterhorn View"
    },
    {
      "url": "https://www.gornergratrail.ch/webcam",
      "label": "Gornergrat Bahn – Railway Station Webcam"
    },
    {
      "url": "https://www.zermatt.ch/en/webcam",
      "label": "Zermatt Village – Matterstrasse (Main Street)"
    },
    {
      "url": "https://www.gornergrat.ch/en/riffelalp-webcam",
      "label": "Riffelalp Station – Alpine Meadow"
    }
  ],
  "elev_chart_attrib_html": "",
  "trip_reports": {
    "hikr_index_url": "https://www.hikr.org/dir/Gornergrat_53843/ped/",
    "takeaways_html": [
      "TODO: cross-report pattern 1.",
      "TODO: cross-report pattern 2."
    ],
    "reports": [
      {
        "url": "https://www.hikr.org/tour/post128765.html",
        "title": "Gornergrat to Riffelalp — Matterhorn views",
        "season": "August 2024",
        "grade": "T2",
        "bullets_html": [
          "Matterhorn dominates every perspective",
          "Gorner Glacier visible below; crevasses present",
          "Riffelalp meadows excellent wildflower habitat July–August"
        ]
      },
      {
        "url": "https://www.hikr.org/tour/post120432.html",
        "title": "Gornergrat Ridge Walk with Gorner Glacier",
        "season": "September 2024",
        "grade": "T2",
        "bullets_html": [
          "Railway efficient access; book in advance peak season",
          "3110m elevation with extreme exposure to lightning",
          "September crowds lighter than peak July–August"
        ]
      }
    ]
  },
  "gear": [
    {
      "title": "Essential",
      "items_html": [
        "<li>Hiking poles</li><li>Sun protection (cream + glasses + hat)</li><li>2 L water</li><li>Emergency snacks</li>"
      ]
    }
  ],
  "safety_html": [
    "TODO: main hazard — e.g. <strong>Exposure</strong>: ... ",
    "Turn back if thunderstorms develop — lightning risk above treeline is extreme."
  ],
  "resources_html": [
    "<a href=\"TODO: SAC route URL\">SAC Route Portal — Gornergrat & Riffelalp</a>",
    "<a href=\"https://www.meteoswiss.admin.ch/\">MeteoSwiss</a>",
    "<a href=\"TODO: SwissTopo map URL\">SwissTopo map</a>"
  ],
  "disclaimer_html": "This page is an informal hike plan, not professional mountain-safety advice. Conditions change rapidly. Always check MeteoSwiss and SAC before setting out."
}