{
  "slug": "greina-plateau",
  "page": {
    "title": "Greina Plateau (2355 m) \u2014 Hike Plan",
    "generated": "2026-05-09",
    "reports_updated": "2026-05-09",
    "year": 2026
  },
  "peak": {
    "name": "Greina Plateau",
    "elev": 2355,
    "lat": 46.6125,
    "lon": 8.9605
  },
  "index_card": {
    "region": "Graub\u00fcnden",
    "canton": "Graub\u00fcnden",
    "distance": "14.5 km",
    "gain": "900 m",
    "time": "5\u20136 h",
    "pill_class": "t2"
  },
  "trailhead": {
    "name": "Vrin",
    "elev": 1453,
    "lat": 46.5767,
    "lon": 8.9283,
    "transit_dest": "Vrin via Sumvitg"
  },
  "hero": {
    "image_url": "https://upload.wikimedia.org/wikipedia/commons/c/cb/Greina_Panorama.jpg",
    "subtitle_html": "Photo \u00a9 Whgler - Swiss Tibet panorama (CC BY-SA 4.0)",
    "grade": "T2"
  },
  "intro_html": "<p>The \"Swiss Tibet\": a vast, windswept, tundra-like protected high-altitude plateau offering Alpine solitude and sweeping 360\u00b0 views across the Lepontine Alps. A timeless Alpine crossing through one of Switzerland's most remote and ecologically precious landscapes.</p>",
  "quick_facts": [
    [
      "Summit elevation",
      "<strong>2355 m</strong>"
    ],
    [
      "SAC grade",
      "<span class=\"pill t2\">T2</span>"
    ],
    [
      "Trailhead",
      "Vrin"
    ],
    [
      "Distance",
      "TODO: km round-trip"
    ],
    [
      "Total ascent",
      "TODO: m"
    ]
  ],
  "photos": [
    {
      "url": "https://upload.wikimedia.org/wikipedia/commons/c/cb/Greina_Panorama.jpg",
      "lightbox_url": "https://upload.wikimedia.org/wikipedia/commons/c/cb/Greina_Panorama.jpg",
      "alt": "View of Greina Plateau",
      "caption_html": "<p><strong>Whgler</strong> \u2014 Wikimedia Commons</p>"
    }
  ],
  "waypoints": [],
  "routes_subtitle": "",
  "routes": [
    {
      "title_html": "TODO: route name",
      "grade": "T2",
      "pill_class": "t2",
      "bullets_html": [
        "TODO: <li>Step by step.</li>"
      ]
    }
  ],
  "getting_there": {
    "by_pt_html": "TODO: SBB / PostBus connection description.",
    "by_car_html": "TODO: Driving directions."
  },
  "day_plans": [
    {
      "title": "Day 1",
      "rows": [
        [
          "HH:MM",
          "TODO: step description"
        ]
      ],
      "footer_html": ""
    }
  ],
  "weather": {
    "lapse_rate": {
      "valley_ref": "TODO: nearest valley station and elevation, e.g. Interlaken (570 m)",
      "summit_above_ref_m": 1755,
      "temp_drop_c": 10.5,
      "example_html": "TODO: e.g. <strong>22 \u00b0C at Interlaken \u2192 ~9 \u00b0C at summit</strong>"
    },
    "sources_html": [
      "<a href=\"https://www.meteoswiss.admin.ch/\">MeteoSwiss</a> \u2014 official Swiss forecast",
      "<a href=\"https://www.meteoblue.com/\">Meteoblue</a> \u2014 hourly wind/precip"
    ],
    "season_html": "TODO: e.g. <strong>July\u2013September</strong> is best; avoid after fresh snow."
  },
  "webcams": [
    {
      "url": "TODO: https://www.foto-webcam.eu/webcam/<nearest-cam>/current/1200.jpg",
      "label": "TODO: camera name",
      "fallback": false
    }
  ],
  "elev_chart_attrib_html": "",
  "trip_reports": {
    "hikr_index_url": "TODO: https://www.hikr.org/region/?gid=...",
    "takeaways_html": [
      "TODO: cross-report pattern 1.",
      "TODO: cross-report pattern 2."
    ],
    "reports": [
      {
        "url": "TODO: hikr report URL",
        "title": "TODO: report title",
        "season": "TODO: e.g. August 2025",
        "grade": "T2",
        "bullets_html": [
          "TODO: <li>Key observation.</li>"
        ]
      }
    ]
  },
  "gear": [
    {
      "title": "Essential",
      "items_html": [
        "<li>Hiking poles</li><li>Sun protection (cream + glasses + hat)</li><li>2 L water</li><li>Emergency snacks</li>"
      ]
    }
  ],
  "safety_html": [
    "TODO: main hazard \u2014 e.g. <strong>Exposure</strong>: ... ",
    "Turn back if thunderstorms develop \u2014 lightning risk above treeline is extreme."
  ],
  "resources_html": [
    "<a href=\"TODO: SAC route URL\">SAC Route Portal \u2014 Greina Plateau</a>",
    "<a href=\"https://www.meteoswiss.admin.ch/\">MeteoSwiss</a>",
    "<a href=\"TODO: SwissTopo map URL\">SwissTopo map</a>"
  ],
  "disclaimer_html": "This page is an informal hike plan, not professional mountain-safety advice. Conditions change rapidly. Always check MeteoSwiss and SAC before setting out."
}