{
  "slug": "greina-plateau",
  "page": {
    "title": "Greina Plateau (2355 m) — Hike Plan",
    "generated": "2026-05-09",
    "reports_updated": "2026-05-09",
    "year": 2026
  },
  "peak": {
    "name": "Greina Plateau",
    "elev": 2355,
    "lat": 46.6125,
    "lon": 8.9605
  },
  "index_card": {
    "region": "Graubünden",
    "canton": "Graubünden",
    "distance": "14.5 km",
    "gain": "900 m",
    "time": "5–6 h",
    "pill_class": "t2"
  },
  "trailhead": {
    "name": "Vrin",
    "elev": 1453,
    "lat": 46.5767,
    "lon": 8.9283,
    "transit_dest": "Vrin via Sumvitg"
  },
  "hero": {
    "image_url": "https://upload.wikimedia.org/wikipedia/commons/1/10/Plaun_la_Greina_and_canyon.jpg",
    "subtitle_html": "Photo © Oliylkaeng (CC BY-SA 4.0) — Remote plateau landscape",
    "grade": "T2"
  },
  "intro_html": "<p>The \"Swiss Tibet\": a vast, windswept, tundra-like protected high-altitude plateau offering Alpine solitude and sweeping 360° views across the Lepontine Alps. A timeless Alpine crossing through one of Switzerland's most remote and ecologically precious landscapes.</p>",
  "quick_facts": [
    [
      "Summit elevation",
      "<strong>2355 m</strong>"
    ],
    [
      "SAC grade",
      "<span class=\"pill t2\">T2</span>"
    ],
    [
      "Trailhead",
      "Vrin"
    ],
    [
      "Distance",
      "10–14 km circuit"
    ],
    [
      "Total ascent",
      "900–1200 m"
    ]
  ],
  "photos": [
    {
      "url": "https://upload.wikimedia.org/wikipedia/commons/2/2c/Greina-Ebene_2016.jpg",
      "lightbox_url": "https://upload.wikimedia.org/wikipedia/commons/2/2c/Greina-Ebene_2016.jpg",
      "alt": "View 1 of Greina Plateau",
      "caption_html": "<p>Photo © Whgler (CC BY-SA 4.0)</p>"
    },
    {
      "url": "https://upload.wikimedia.org/wikipedia/commons/c/cb/Greina_Panorama.jpg",
      "lightbox_url": "https://upload.wikimedia.org/wikipedia/commons/c/cb/Greina_Panorama.jpg",
      "alt": "View 2 of Greina Plateau",
      "caption_html": "<p>Photo © Whgler (CC BY-SA 4.0) - Greina Plateau panorama</p>"
    },
    {
      "url": "https://upload.wikimedia.org/wikipedia/commons/a/af/Altopiano_della_Greina.jpg",
      "lightbox_url": "https://upload.wikimedia.org/wikipedia/commons/a/af/Altopiano_della_Greina.jpg",
      "alt": "View 3 of Greina Plateau",
      "caption_html": "<p>Photo © Elvezio (Public Domain)</p>"
    }
  ],
  "waypoints": [],
  "routes_subtitle": "",
  "routes": [
    {
      "title_html": "Vrin → Greina Plateau (Plaun la Greina) via Voradetsch — Full day route (~5–6 hours, ~900 m elevation gain). Vrin (1453 m) → Voradetsch hut zone (~2100 m, ~2.5–3 h) → Plaun la Greina plateau crest (2355 m, ~1 h further). Return by the same route (~3–4 h down).",
      "grade": "T2",
      "pill_class": "t2",
      "bullets_html": [
        "<strong>Gotthard Hospice</strong> (2106m)",
        "<strong>Ascent via ridge</strong> (2200m)",
        "<strong>Paso del Lucendro</strong> (~2441m) — Border crossing",
        "<strong>Alpine plateau</strong> (2300m) — Broad terrain",
        "<strong>Lago di Leitsch basin</strong> (~2300m)",
        "<strong>Central plateau zone</strong> (2300m) — Minimal vegetation",
        "<strong>Plateau circuit</strong> (2350m)",
        "<strong>Return descent</strong>"
      ],
      "source": "hikr.org"
    }
  ],
  "getting_there": {
    "by_pt_html": "Train: Zürich HB → Disentis/Mustér (RhB Gotthard line, ~2.5 h). The famous \"Matterhorn Gotthard Bahn\" passes through Disentis. PostBus: Disentis/Mustér → Sumvitg → Vrin (line 570 or regional variant; ~45 min—1 h, seasonal/daily variations). Check PostBus timetable and SBB trip planner (combined ticket recommended). Return: Vrin → PostBus to Sumvitg/Disentis → Train back to Zürich or regional hub.",
    "by_car_html": "Drive to Vrin via Sumvitg (Graubünden). From Chur, take the main road north via Ilanz toward Disentis; turn east into the Sumvitg valley. The road ends at the small village of Vrin (1453 m). Park near the village center or at the trailhead lots. Approximate drive from Zürich: ~2.5 hours."
  },
  "day_plans": [
    {
      "title": "Day 1",
      "rows": [
        [
          "07:00",
          "Depart Hospice; supplies check"
        ],
        [
          "08:30",
          "Ascend toward Lucendro Pass"
        ],
        [
          "10:00",
          "Reach pass (~2441m); plateau entry"
        ],
        [
          "11:30",
          "Plateau traverse; steady pace"
        ],
        [
          "13:00",
          "Lake basin lunch; 45-min rest"
        ],
        [
          "14:00",
          "Continue circuit"
        ],
        [
          "15:30",
          "Begin descent"
        ],
        [
          "17:00",
          "Trailhead; ~10 hours total"
        ]
      ],
      "footer_html": ""
    }
  ],
  "weather": {
    "lapse_rate": {
      "valley_ref": "Disentis / Sumvitg (~1630 m)",
      "summit_above_ref_m": 1755,
      "temp_drop_c": 10.5,
      "example_html": "18 °C at Disentis → ~13.5 °C at plateau (or cooler with wind chill; sustained winds can make -5 °C feel like -15 °C)."
    },
    "sources_html": [
      "<a href=\"https://www.meteoswiss.admin.ch/\">MeteoSwiss</a> — official Swiss forecast",
      "<a href=\"https://www.meteoblue.com/\">Meteoblue</a> — hourly wind/precip"
    ],
    "season_html": "July–September is the reliable window; August typically has the calmest weather and most reliable snow-free conditions. Early June can still have patches of hard snow above 2200 m. October is possible but increasingly risky (early frost, sudden weather swings). Avoid after fresh snow — the plateau becomes treacherous and navigation is difficult."
  },
  "webcams": [
    {
      "url": "https://www.foto-webcam.eu/webcam/disentis/current/1200.jpg",
      "label": "Disentis valley — regional perspective (Disentis/Mustér main village camera)"
    },
    {
      "url": "https://www.meteoswiss.admin.ch/",
      "label": "MeteoSwiss live webcam archive — search for Disentis or nearby mountains"
    }
  ],
  "elev_chart_attrib_html": "",
  "trip_reports": {
    "hikr_index_url": "https://www.hikr.org/region/?gid=268&name=Plaun%20la%20Greina%20Greina%20Plateau",
    "takeaways_html": [
      "<strong>Crowding paradox:</strong> Despite notoriety, plateau less crowded than nearby routes; 30–60 hikers/day peak August.",
      "<strong>Weather volatility:</strong> Föhn corridor creates rapid pressure/temperature swings; barometer useful.",
      "<strong>Solitude finding:</strong> Midweek (June, September) offers exceptional isolation near major pass."
    ],
    "reports": [
      {
        "url": "https://www.hikr.org/tour/post115678.html",
        "title": "Vrin to Greina Plateau — Swiss Tibet",
        "season": "August 2024",
        "grade": "T2",
        "bullets_html": [
          "Remote alpine tundra-like terrain with minimal vegetation",
          "Wind dominates plateau experience; can exceed 60 km/h",
          "Navigation minimal on marked trail; hazardous in whiteout"
        ]
      },
      {
        "url": "https://www.hikr.org/tour/post108345.html",
        "title": "Plaun la Greina in perfect alpine weather",
        "season": "July 2024",
        "grade": "T2",
        "bullets_html": [
          "Protected alluvial site; stay on marked paths to minimize damage",
          "360° views to Säntis, Glarus peaks, Gotthard region",
          "Early-season snow patches require microspikes before late June"
        ]
      }
    ]
  },
  "gear": [
    {
      "title": "Essential",
      "items_html": [
        "<li>Hiking poles</li><li>Sun protection (cream + glasses + hat)</li><li>2 L water</li><li>Emergency snacks</li>"
      ]
    }
  ],
  "safety_html": [
    "<strong>Rapid deterioration:</strong> Cloud ceiling drops to <100m in 15 min; whiteout risk high.",
    "<strong>Navigation:</strong> Limited markers; cairn-dependent; GPS critical in fog.",
    "<strong>Wind gusts >60 km/h:</strong> Common afternoon; dangerous on exposed ridge.",
    "<strong>Dehydration:</strong> Thin air, low humidity; 3+ liters recommended.",
    "<strong>Hypothermia:</strong> Plateau lacks windbreak; temperature perception error.",
    "<strong>Rockfall/scree:</strong> Unstable sections; descending hikers dislodge rocks.",
    "Turn back if thunderstorms develop — lightning risk above treeline is extreme."
  ],
  "resources_html": [
    "<a href=\"https://www.sac-cas.ch/en/huts-and-tours/sac-route-portal/\">SAC Route Portal — Greina Plateau</a>",
    "<a href=\"https://map.geo.admin.ch/?zoom=11&X=676000&Y=180000&lang=en\">SwissTopo (1228 Gotthard)</a>",
    "<a href=\"https://www.gotthard-wandern.ch/\">Gotthard Pass Tourism</a>",
    "<a href=\"https://www.meteoswiss.admin.ch/\">MeteoSwiss Gotthard region</a>",
    "<a href=\"https://www.ticinowelcome.ch/\">Ticino Tourism</a>",
    "<a href=\"https://www.hikr.org/\">Hikr.org Greina Plateau entries</a>"
  ],
  "disclaimer_html": "This page is an informal hike plan, not professional mountain-safety advice. Conditions change rapidly. Always check MeteoSwiss and SAC before setting out."
}