{
  "slug": "niesen-kulm",
  "page": {
    "title": "Niesen Kulm (2362 m) — Hike Plan",
    "generated": "2026-05-09",
    "reports_updated": "2026-05-09",
    "year": 2026
  },
  "peak": {
    "name": "Niesen",
    "elev": 2362,
    "lat": 46.6461,
    "lon": 7.6525
  },
  "index_card": {
    "region": "Bernese Oberland",
    "canton": "Bern",
    "distance": "7.5 km",
    "gain": "1700 m",
    "time": "4–5 h",
    "pill_class": "t2"
  },
  "trailhead": {
    "name": "Mülenen",
    "elev": 680,
    "lat": 46.5926,
    "lon": 7.6795,
    "transit_dest": "Mülenen"
  },
  "hero": {
    "image_url": "https://upload.wikimedia.org/wikipedia/commons/e/ef/Niesen_Panorama.jpg",
    "subtitle_html": "Photo © Simon Eggimann (Featured Wikipedia image)",
    "grade": "T2"
  },
  "intro_html": "<p>The iconic \"Swiss Pyramid\" – a relentless 1700 m climb with extraordinary views of Lake Thun and the Bernese Alps. Popular funicular descent option.</p>",
  "quick_facts": [
    [
      "Summit elevation",
      "<strong>2362 m</strong>"
    ],
    [
      "SAC grade",
      "<span class=\"pill t2\">T2</span>"
    ],
    [
      "Trailhead",
      "Mülenen"
    ],
    [
      "Distance",
      "~16 km round-trip"
    ],
    [
      "Total ascent",
      "~1700 m"
    ]
  ],
  "photos": [
    {
      "url": "https://upload.wikimedia.org/wikipedia/commons/e/ef/Niesen_Panorama.jpg",
      "lightbox_url": "https://upload.wikimedia.org/wikipedia/commons/e/ef/Niesen_Panorama.jpg",
      "alt": "View 1 of Niesen Kulm",
      "caption_html": "<p>Photo © Simon Eggimann (Featured Wikipedia image)</p>"
    },
    {
      "url": "https://upload.wikimedia.org/wikipedia/commons/d/dc/Niesen2.jpg",
      "lightbox_url": "https://upload.wikimedia.org/wikipedia/commons/d/dc/Niesen2.jpg",
      "alt": "View 2 of Niesen Kulm",
      "caption_html": "<p>Photo © Stefan Grünig</p>"
    },
    {
      "url": "https://upload.wikimedia.org/wikipedia/commons/4/4d/Mountain_Niesen_-_View_from_Merligen_Thunersee.jpg",
      "lightbox_url": "https://upload.wikimedia.org/wikipedia/commons/4/4d/Mountain_Niesen_-_View_from_Merligen_Thunersee.jpg",
      "alt": "View 3 of Niesen Kulm",
      "caption_html": "<p>Photo © Marco Ghinolfi (CC0)</p>"
    }
  ],
  "waypoints": [],
  "routes_subtitle": "",
  "routes": [
    {
      "title_html": "Mülenen → Niesen Kulm — the classic \"Swiss Pyramid\" ascent — A relentless but non-technical 1700 m climb from the valley floor, gaining elevation through pasture, forest, and alpine terrain. Iconic views of Lake Thun dominate the descent.",
      "grade": "T2",
      "pill_class": "t2",
      "bullets_html": [
        "<strong>Reichenbach trailhead</strong> (707m) — Start point; zigzag forest trail",
        "<strong>Stöpfflue</strong> (1105m) — First elevation pass; meet asphalt road",
        "<strong>Schwandegg Station</strong> (1666m) — Intermediate funicular station; enters more open terrain",
        "<strong>Glogghore</strong> (1984m) — Ridge waypoint with serpentine paths",
        "<strong>Räbmättli</strong> (~2150m) — High meadow; final approach begins",
        "<strong>Niesen Kulm summit</strong> (2362m) — Restaurant and panoramic views of Lake Thun"
      ]
    }
  ],
  "getting_there": {
    "by_pt_html": "Train + PostBus: From Thun (main station), take the regional train toward Spiez (~10 min), then board PostBus line 1 or 2 toward Mülenen (~30 min from Spiez, final stop). Combined SBB + PostBus journey ≈60 min total. From Interlaken, take the scenic train to Thun (~20 min) then proceed as above. Swiss Travel Pass covers both; check current PostBus route numbers on sbb.ch.",
    "by_car_html": "Via Simmental: From Thun, drive south toward Spiez, then follow the scenic Simmental valley road toward Mülenen (1680m elevation, ~40 km from Thun center, ~45–50 min). Excellent parking at the Mülenen trailhead near the valley station; ample space and facilities. Alternatively, approach from Bern via Spiez. Road access is open year-round but can be busy on weekends."
  },
  "day_plans": [
    {
      "title": "Day 1",
      "rows": [
        ["07:00", "Depart Reichenbach trailhead; cool morning, beat crowds"],
        ["07:30", "Reach Stöpfflue (1105m); first viewpoint, 30 min/400m gain"],
        ["08:30", "Arrive Schlächtewald (1436m); steady alp road, 1 hour/330m gain"],
        ["09:30", "Meet Schwandegg Station (1666m); funicular line, 1 hour/230m gain"],
        ["10:45", "Reach Glogghore (1984m); steep serpentines, 1h 15m/320m gain"],
        ["11:45", "Arrive Räbmättli (~2150m); ridge approach, 1 hour/160m gain"],
        ["12:15", "Summit Niesen Kulm (2362m); total 5 hours up"],
        ["12:45–13:15", "Lunch break & summit views; restaurant open in summer"],
        ["17:30–18:00", "Return Reichenbach; 5+ hours down; 9.5–10.5 hours total"]
      ],
      "footer_html": ""
    }
  ],
  "weather": {
    "lapse_rate": {
      "valley_ref": "Thun (428 m) — main valley reference for Thunersee region",
      "summit_above_ref_m": 1762,
      "temp_drop_c": 10.6,
      "example_html": "20 °C at Thun → ~7 °C at Niesen Kulm (2362 m) — typical July afternoon. Wind exposure on the summit is high; bring extra layers."
    },
    "sources_html": [
      "<a href=\"https://www.meteoswiss.admin.ch/\">MeteoSwiss</a> — official Swiss forecast",
      "<a href=\"https://www.meteoblue.com/\">Meteoblue</a> — hourly wind/precip"
    ],
    "season_html": "July–September is optimal: stable weather, minimal snow, warm(ish) days. June can see snow patches above 1800 m. October deteriorates with increasing cloud and wind. The Niesen-Bahn funicular operates May–October, so plan descent accordingly if using the railway."
  },
  "webcams": [
    {
      "url": "https://www.foto-webcam.eu/webcam/thun/current/1200.jpg",
      "label": "Thun — valley-level view"
    },
    {
      "url": "https://www.foto-webcam.eu/webcam/interlaken/current/1200.jpg",
      "label": "Interlaken — Bernese Oberland perspective"
    }
  ],
  "elev_chart_attrib_html": "",
  "trip_reports": {
    "hikr_index_url": "https://www.hikr.org/dir/Niesen_1450/",
    "takeaways_html": [
      "<strong>Relentless steep gain from valley floor:</strong> Unbroken 1700m ascent; no real warm-up section. Valley base (707m) is unusually low; switchbacks don't relieve grade until mid-slope.",
      "<strong>Overwhelming funicular tourist crowds:</strong> Masses of non-hiking tourists using the train create heavy congestion on upper trails. Serious hikers avoid Schwandegg section during peak train times (1:30–2:30pm).",
      "<strong>'Bähnli-Berg' paradox:</strong> Funicular makes it a tourist destination; lower section from Reichenbach offers escape from crowds but adds 1700m vs. using mid-station. Upper trail becomes very crowded 10:00–16:00."

    ],
    "reports": [
      {
        "url": "https://www.hikr.org/tour/post187234.html",
        "title": "Niesen — Swiss Pyramid ascent with Thunersee views",
        "season": "August 2024",
        "grade": "T2",
        "bullets_html": [
          "1700m gain is relentless but rewarding",
          "Mülenen trailhead easily accessible; ample parking",
          "Funicular descent is legitimate time-saver (CHF 17)"
        ]
      },
      {
        "url": "https://www.hikr.org/tour/post179345.html",
        "title": "Mülenen to Niesen descent via funicular",
        "season": "September 2024",
        "grade": "T2",
        "bullets_html": [
          "Afternoon thunderstorm risk is real; turn back by 13:30",
          "360° summit panorama includes Jungfrau and Säntis",
          "Fewer crowds midweek than weekends"
        ]
      }
    ]
  },
  "gear": [
    {
      "title": "Essential",
      "items_html": [
        "<li>Hiking poles</li><li>Sun protection (cream + glasses + hat)</li><li>2 L water</li><li>Emergency snacks</li>"
      ]
    }
  ],
  "safety_html": [
    "<strong>Unrelenting grade:</strong> Steep ascent throughout; no terrain flattening until upper meadows. Recovery time limited; cumulative fatigue risk.",
    "<strong>Weather exposure:</strong> Pyramid shape + 2362m elevation = exposed ridge; afternoon thunderstorms common May–September.",
    "<strong>Trail congestion:</strong> Summer crowds peak 10:00–16:00; tight single-track on upper sections; traffic jams during turnaround.",
    "<strong>Descent risk:</strong> Long downhill pounding on knees; loose scree on alternative descents.",
    "<strong>Spring/winter transitions:</strong> Snowmelt creates water channels; icy sections on north-facing slopes (April, Oct–Nov).",
    "<strong>Heat in July–Aug:</strong> South-facing slopes offer minimal shade; dehydration risk on steep sections.",
    "Turn back if thunderstorms develop — lightning risk above treeline is extreme."
  ],
  "resources_html": [
    "<a href=\"https://www.sac-cas.ch/en/huts-and-tours/sac-route-portal/\">SAC Route Portal — Niesen Kulm</a>",
    "<a href=\"https://www.meteoswiss.admin.ch/\">MeteoSwiss</a> — official Swiss forecast",
    "<a href=\"https://map.geo.admin.ch/?zoom=11&X=616000&Y=620000&lang=en\">SwissTopo map (1:25,000) — Interlaken area</a>",
    "<a href=\"https://www.niesenbahn.ch/\">Niesenbahn</a> — funicular railway schedules (April–November)",
    "<a href=\"https://www.hikr.org/\">Hikr.org trip reports — Niesen</a>"
  ],
  "disclaimer_html": "This page is an informal hike plan, not professional mountain-safety advice. Conditions change rapidly. Always check MeteoSwiss and SAC before setting out."
}